id,reference,candidate,bleurt
eb39e1395ad10fd27f5688d5f7f589e1eac61738,"Selena Quintanilla-Perez will be re-created as hologram-like figure .
The Tejano singer is first to be part of a new technology, says sister .
Selena was killed 20 years ago but remains hugely popular .","(CNN)Tejano star Selena, who died 20 years ago, is coming back in a big way: with a hologram-like figure. Billboard reports that the singer's family is creating a version of the singer that will be ""walking, talking, singing and dancing digital embodiment"" of her persona. ""By no means is this something that's creepy or weird,"" her sister, Suzette Quintanilla, told Billboard.",0.33286261558532715
12d18fce81557ef7d4e34874e709376defd1819d,"100 passengers and crew members have been sickened on Celebrity Infinity .
The ship, which is based on the West Coast, left San Diego in late March .
The CDC is scheduled to board the ship Monday .","(CNN)Gastrointestinal illness has gripped 100 people on the cruise ship Celebrity Infinity, according to a report from the Centers for Disease Control. Of the ship's 2,117 passengers, 95 have suffered from vomiting, diarrhea and other symptoms, the CDC said. The illness has also affected five members of the 964-person crew.",0.275327205657959
0b66cb7ebcfd16de6d6d7623036c2dd9161f032b,"""Twin Peaks"" creator David Lynch announced he was departing the Showtime revival of the cult series Sunday .
Cast members of the show posted a YouTube video Wednesday pleading for him to return .
Wednesday was the series' 25th anniversary .","(The Hollywood Reporter)The original cast of Twin Peaks is backing David Lynch in his salary standoff with Showtime. The stars have teamed together for a video backing the show's co-creator with a #SaveTwinPeaks campaign that says doing the revival without Lynch is ""like pies without cherries,"" among other nods to the original drama series. Sherilyn Fenn, Sheryl Lee, James Marshall, Peggy Lipton and other familiar faces from the series appear in the video.",0.25289496779441833
054ccc280767c3d59e7da55572425d2fdcb6e711,"Former TSA agent Daniel Boykin, 33, videotaped his female co-worker in the restroom, authorities say .
Authorities say they found 90 videos and 1,500 photos of the victim on Boykin's phone and computer .
Boykin worked in an administrative capacity and didn't do public security screenings, TSA official says .","(CNN)A judge this week sentenced a former TSA agent to six months in jail for secretly videotaping a female co-worker while she was in the bathroom, prosecutors said. During the investigation, detectives with the Metro Nashville Police Department in Tennessee also found that the agent, 33-year-old Daniel Boykin, entered the woman's home multiple times, where he took videos, photos and other data. Police found more than 90 videos and 1,500 photos of the victim on Boykin's phone and computer.",0.3338388502597809
eaf4a7864208468af3cdc858185b807d54110e95,"Five young women have been detained by China since early March .
They campaigned against sexual harassment .
Their detention has attracted international criticism .","(CNN)Five young Chinese feminists, whose detention has provoked an international outcry, may face up to five years in prison over their campaign for gender equality. The women were among detained on March 6 and March 7 in three Chinese cities -- Beijing, Guangzhou and Hangzhou -- shortly before events they had planned for International Women's Day on March 8. Wang Qiushi, the lawyer for one of the women, Wei Tingting, said police had recommended on April 6 that prosecutors press charges of ""assembling a crowd to disturb public order."" Wang told CNN that prosecutors had to decide whether to pursue the charges within seven days of the submission -- by Monday.",0.23756974935531616
b7c282a0373913300e4cb1d5bb529c068b550618,"Debris from boat to be dried, inspected and taken to landfill .
The debris contained fish normally found in Japanese waters .
The earthquake and tsunami hit Japan in March 2011 .","(CNN)Those poor fish must have been wondering what the heck was happening to them. The Oregon Parks and Recreation Department has reported that a section of a fiberglass boat 20 or 30 feet long was spotted off the state's coast this week and has been towed into harbor. The debris is suspected to be from the earthquake and tsunami that hit Japan on March 11, 2011.",0.2609529495239258
20a6b5894c4cd75e32f6f4946467854aeb539337,"Case begins when police find video of what appears to be a gang rape .
2 students from Troy University in Alabama are charged in the case .","(CNN)Two Alabama college students are accused of gang raping a woman while on spring break at Florida's Panama City Beach. Ryan Calhoun and Delonte Martistee, students at Troy University, were arrested and charged with sexual battery by multiple perpetrators, according to a statement from the Bay County, Florida, Sheriff's Office. The Troy, Alabama, Police Department found video of what appeared to be a Panama City gang rape during the course of an investigation into an unrelated shooting.",0.3412892520427704
130663882dcf622a6069d2ab429acde689b9f428,"A couple named Burger and King?
Internet has a meltdown over ""Vampire Diaries"" departure .","(CNN)""Star Wars"" is once again back in our lives, the Burger-King couple helped us believe love can be found in fast food, and Mindy Kaling's brother had a shocking announcement. Those are just a few of the stories that trended this week. 1.",0.23898255825042725
5493b9481b00e8ca9d83320d00abe09266bbeaef,"ISIS says it controls several buildings at the Baiji oil refinery .
Iraqi government security officials say Iraqi forces remain in full control .
The refinery, Iraq's largest, has long been a lucrative target for militants .","Irbil, Iraq (CNN)ISIS claimed it controlled part of Iraq's largest oil refinery Sunday, posting images online that purported to show the storming of the facility, fierce clashes and plumes of smoke rising above the contested site. The group said it launched an assault on the Baiji oil refinery late Saturday. By Sunday, ISIS said its fighters were inside the refinery and controlled several buildings, but Iraqi government security officials denied that claim and insisted Iraqi forces remain in full control.",0.3264734745025635
3fbdee096ce9d027da681c5f9c89eb319ff21a9f,"Cuba pulled off a diplomatic coup by gaining attendance at Summit of the Americas .
First time since 1962, the U.S. has not blocked Cuba's attempt to join .
Cuba is trying to re-establish itself at the two-day summit in Panama .","Havana, Cuba (CNN)All eyes are going to be on the new kid finally allowed to play and the big kid who for so long wanted nothing to do with him -- Cuba and the United States in the same diplomatic playground. Cuba pulled off a diplomatic coup by marshaling the support of other regional countries to insist on their attendance at the Summit of the Americas. And for the first time since 1962, the U.S.",0.3093907833099365
837970f6b544e927c6fe2261a81f74f8313f2bdf,"Ramp agent tells authorities he fell asleep in cargo hold, Alaska Airlines says .
The cargo hold is pressurized and temperature controlled .",(CNN)Getting caught napping on the job is never good. Getting caught napping on the job in the cargo hold of a plane takes it to a whole different level. Alaska Airlines Flight 448 was just barely on its way to Los Angeles from Seattle-Tacoma International Airport on Monday afternoon when the pilot reported hearing unusual banging from the cargo hold.,0.285935640335083
b882ed05925f8879660ec4f9efdcded1d5e45561,"Nigeria's President-elect sends nation's prayers to families of girls .
World still expresses hope that the girls will return .
Boko Haram controls a portion of northeastern Nigeria .","(CNN)One year after it was perpetrated, the kidnapping of nearly 300 schoolgirls by a jihadist group in Nigeria remains a crime almost too horrifying to comprehend: Hundreds of teenaged girls, just finishing school, destined perhaps for significant achievement -- kidnapped, never to be seen again. ""This crime has rightly caused outrage both in Nigeria and across the world,"" the country's President-elect, Muhammadu Buhari, said Tuesday in marking the anniversary. ""Today is a time to reflect on the pain and suffering of the victims, their friends and families.",0.2732385993003845
5231a93ff48e3dcdc22ea9df981237c26a474714,"The Walter Scott shooting inspired a local artist to create artwork .
Phillip Hyman crafted the angel-winged artwork in the middle of the night .
Protesters from the Black Lives Matter movement have started using it as his symbol .","(CNN)A hooded angel with black wings appeared on Tuesday near the spot where Walter Scott was shot and killed by a police officer in North Charleston, South Carolina, on Saturday. Since then, it's been taken up as an icon of the Black Lives Matter movement. When protesters held the winged figure at a Wednesday morning rally outside North Charleston's City Hall, the artwork was widely photographed.",0.3017280697822571
da9588f556b1c3575e7ad2109967fa3156699813,"Temperatures dipped into the mid-30s during 4 days man lay in woods of Philadelphia park .
Mom told police son was with her in Maryland, but he was found Friday with blanket, Bible .
Victim being treated for malnutrition, dehydration; mother faces host of charges after extradition .","(CNN)For more than four days, police say, a 21-year-old quadriplegic with cerebral palsy was left lying in the woods of Philadelphia's Cobbs Creek Park with only a blanket and a Bible. The person responsible is the man's mother, who on Sunday faced a host of charges after allegedly abandoning her son and catching a bus to Maryland to see her boyfriend, said Philadelphia police Lt. John Walker.",0.2989678382873535
bbe26fc38175793719dd50c23605f1c96c579b08,"One man's entrepreneurial quest turned into unexpected success .
""100 Days of Rejection"" took Jiang out of his comfort zone .
It's the fear of rejection, more than rejection itself, which holds us back .","(CNN)What would you do if a complete stranger asked you for $100, or offered you an apple in a parking lot without explanation? These are only two of the 100 challenges Chinese-born, American-based Jia Jiang put himself up to when he decided to blog about ""100 Days of Rejection"", a project he launched after he quit his comfortable six-figure job to follow his dreams of being an entrepreneur at the age of 30, just weeks before his first child was born. After his tech start-up was declined investment, Jiang decided to confront his fear of rejection head-on.",0.2454771250486374
3bfe27dc86f0424787f32deb16df09a902c6a8e6,"Bystanders stopped to rescue a lost brood of ducklings in D.C. Tuesday .
CNN's Brian Todd and Khalil Abdallah paused to capture the scene .","(CNN)It was like a scene out of ""Make Way for Ducklings"" on Tuesday on a rainy street in Washington. CNN Situation Room correspondent Brian Todd and photojournalist Khalil Abdallah were on their way to interview a legal analyst on L Street NW when they happened on a brood of baby ducks causing a stir. Abdallah reports the ducklings and their mom had crossed heavily trafficked street, and some restaurant patrons stopped on the sidewalk to corral them.",0.31940072774887085
f97b9b19e5a90dce0fc0b098f2a7f70ec36445fb,"Philadelphia police add attempted murder to list of charges mom will face .
Mom told police son was with her in Maryland, but he was found Friday alone in woods .
Victim being treated for malnutrition, dehydration; mother faces host of charges after extradition .","(CNN)Police added attempted murder to the list of charges against the mother of a quadriplegic man who was left in the woods for days, Philadelphia police spokeswoman Christine O'Brien said Tuesday. Nyia Parler cannot be extradited to face the charges in Philadelphia until she completes an unspecified ""treatment,"" Maryland police said Monday. When she does arrive, she will be charged with aggravated assault, simple assault, recklessly endangering another person and related offenses, in addition to the attempted murder count, O'Brien said.",0.30952927470207214
5139ccfabee55ddb83e7937f5802c0a67aee8975,"The incident occurred on April 7 north of Poland in the Baltic Sea .
U.S. says plane was in international airspace .
Russia says it had transponder turned off and was flying toward Russia .","(CNN)After a Russian fighter jet intercepted a U.S. reconnaissance plane in an ""unsafe and unprofessional manner"" earlier this week, the United States is complaining to Moscow about the incident. On Tuesday, a U.S.",0.18967390060424805
0f39feebc34fee03b8c647d1557eb40bb20f4e8b,"Mother must complete ""treatment"" before she can be extradited, Maryland police say .
Mom told police son was with her in Maryland, but he was found Friday alone in woods .
Victim being treated for malnutrition, dehydration; mother faces host of charges after extradition .","(CNN)The mother of a quadriplegic man who police say was left in the woods for days cannot be extradited to face charges in Philadelphia until she completes an unspecified ""treatment,"" Maryland police said Monday. The Montgomery County (Maryland) Department of Police took Nyia Parler, 41, into custody Sunday after Philadelphia police reported that she left her 21-year-old son in the woods while she hopped a bus to see her boyfriend in Maryland. A man walking through the woods found him Friday ""lying in leaves, covered in a blanket with a Bible and a wheelchair nearby,"" Philadelphia police say.",0.2910432815551758
89daa80db49b6e36c1cd0bde9b253ca7fa143811,"A new Kansas law bans what it describes as ""dismemberment abortion""
Supporters say it's a groundbreaking step .
Opponents say it's dangerous and politically motivated .","(CNN)A new Kansas law banning a common second-term abortion procedure is the first of its kind in the United States. The law, signed by Kansas Gov. Sam Brownback on Tuesday, bans what it describes as ""dismemberment abortion"" and defines as ""knowingly dismembering a living unborn child and extracting such unborn child one piece at a time from the uterus."" Supporters of the measure described it as a groundbreaking step, while opponents warned it was dangerous and among the most restrictive abortion laws in the country.",0.4514470100402832
fcd69b35b0bdae540d8357d0029369ab3cef1363,"Dillard was the first of the Duggar daughters to be married .
Her 9-pound, 10-ounce son was overdue .","(CNN)The first daughter to be married from the hit reality show ""19 Kids and Counting"" has also become the first mother. People magazine reports that Jill (Duggar) Dillard gave birth Monday to a 9-pound, 10-ounce son she and husband Derick have named Israel David. Jill's parents, Jim Bob and Michelle Duggar, posted a video of the new family on their official Facebook page.",0.2629454433917999
c0340e53445e1d38aaf9a2681c2ae2e950a98860,"Relatives of Wayne Community College shooting victim say he was gay, local media report .
The suspect had worked for the victim but was let go, college president says .
The suspect, Kenneth Morgan Stancil III, was found sleeping on a Florida beach and arrested .","(CNN)The killing of an employee at Wayne Community College in Goldsboro, North Carolina, may have been a hate crime, authorities said Tuesday. Investigators are looking into the possibility, said Goldsboro police Sgt. Jeremy Sutton.",0.24000081419944763
36ac591f1b7a4eb01b7301b50912c5791c38386a,"Richie Benaud first earned fame as a cricket player, later as broadcaster .
Prime Minister Tony Abbott calls him ""a cricketing champion and Australian icon""","(CNN)Former Australia cricket captain and legendary broadcaster Richie Benaud has died at the age of 84. Benaud, whose witty one-liners from the commentary box resonated far beyond Australia's shores, said last year he was being treated for skin cancer. ""After Don Bradman, there has been no Australian player more famous than Richie Benaud,"" Cricket Australia said on its website.",0.2723844349384308
f97442bee2acf684b1b8d5e653acea2307fc5dad,"Company known for use of publicity stunts .
Tweet contained pun on name of Liverpool's Kop stand .
It was used to link to Liverpool-Newcastle stats .
Social media backlash leads to apology .","(CNN)Irish betting company Paddy Power is backtracking after tweeting that ""Newcastle have suffered more Kop beatings over the last 20 years than an unarmed African-American male."" The tweet, a pun on the name of the famous home end at Liverpool Football Club, alluded to recent controversial incidents in the United States in which unarmed African-American men have been killed by police. Paddy Power -- well-known for its use of publicity stunts -- used it to link to a piece showing statistics for games between Liverpool and Newcastle United ahead of their English Premier League match on Monday. A Paddy Power spokesman told CNN before Liverpool's 2-0 victory at Anfield: ""It was a joke, and no offense was meant."" The tweet has since been deleted, but its removal -- along with the statement -- did little to placate social media users who condemned the organization, with some calling for the person who wrote the tweet to be sacked.",0.3150950074195862
74e99c26d8bb7ef87afa0784082c2918927e753e,"The migrants were picked up 30 miles off the coast of Libya, an Italian leader says .
At least 480 migrants have died while crossing the Mediterranean this year .","(CNN)Desperate migrants from Africa and the Middle East keep heading to Europe, with 978 rescued Friday in the Mediterranean Sea, the Italian Coast Guard said Saturday via Twitter. The migrants were picked up 30 miles off the coast of Libya, said European Parliament member Matteo Salvini, the leader of Italy's far-right Northern League. In the first three months of 2015, Italy registered more than 10,000 migrants arriving, the International Organization for Migration said, and about 2,000 were rescued at sea during the first weekend of April in the Channel of Sicily.",0.2881833016872406
e709f9942da05f8747aa6bc61952de27090512ac,"In an interview with The New York Times, President Obama says he understands Israel feels particularly vulnerable .
Obama calls the nuclear deal with Iran a ""once-in-a-lifetime opportunity""
Israeli Prime Minister Benjamin Netanyahu and many U.S. Republicans warn that Iran cannot be trusted .","Washington (CNN)President Barack Obama says he is ""absolutely committed to making sure"" Israel maintains a military advantage over Iran. His comments to The New York Times, published on Sunday, come amid criticism from Israeli Prime Minister Benjamin Netanyahu of the deal that the United States and five other world powers struck with Iran. Tehran agreed to halt the country's nuclear ambitions, and in exchange, Western powers would drop sanctions that have hurt the Iran's economy.",0.3820546865463257
07f60889bcd1f3d2c48b715220f13df8d2c5e158,"Cape Verde seeking to tap-into rich cultural heritage .
Tiny island nation wants to grow creative economy .","(CNN)There's an old saying which states the Cape Verde Islands are home to a greater number of musicians per square kilometer than any other country in the world. In truth, such a definitive claim may be nigh on impossible to prove. But there is a certain factual accuracy behind the legend: the important and proud relationship the Atlantic island country of just 500,000 people has with music.",0.2632068693637848
454434c7bf77d898feba8ff0e38a2d1dd68c44ba,"New research indicates that a play published in 1728 was written by William Shakespeare .
Scholar Lewis Theobald had passed the work off as his own .
Texas researchers used software to analyze and compare the language of the men .","(CNN)""Hamlet."" ""Romeo and Juliet."" ""A Midsummer Night's Dream."" For centuries, these plays and three dozen more by William Shakespeare have formed history's most heralded literary canon. But now they may have to make room for an addition to Shakespeare's famous oeuvre. New research indicates that ""Double Falsehood,"" a play first published in 1728 by Lewis Theobald, was actually written more than a century earlier by Shakespeare himself with help from his friend John Fletcher.",0.23422151803970337
bbdc0e58a203b016166f896936d9862ae9fd11be,"The attack at a Garissa university last week killed 147 people, mostly students .
The government is tracking the finances of people suspected of ties to Al-Shabaab .","Nairobi, Kenya  (CNN)Kenya froze dozens of accounts linked to suspected terror supporters after militants massacred 147 people last week at a university in Garissa. The government is tracking the finances of people suspected of ties to Al-Shabaab, the militant group that claimed responsibility for the Thursday attack. So far, the government has frozen 86 accounts, but that number could go up, said Mwenda Njoka, a spokesman for the  Interior Ministry.",0.4118425250053406
7e4d197d5fe8272c0471199cf9987f3786a80c2b,"Jodi Arias is sentenced to life in prison with no possibility for parole .
Arias expressed remorse for her actions .","(CNN)Jodi Arias was sentenced to life in prison Monday for the gruesome 2008 murder of her ex-boyfriend Travis Alexander. Maricopa County Judge Sherry Stephens could have sentenced Arias to life with the possibility of early release after 25 years, but decided the convicted killer should spend the rest of her life behind bars. Before her sentence was handed down, Arias expressed remorse for her actions.",0.3518843650817871
6ce9f3ddbed94dc2223aea4b851ebedbb67f8c56,"Maya Wang: 5 women held by China authorities after planning International Women's Day protests on sex harassment remain detained .
She says in a year when country poised to adopt  anti-domestic violence law, Beijing also sending chilling message on women's activism .","(CNN)Last month Wu Rongrong was taken into custody for planning to protest on International Women's Day against sexual harassment in China. Since then, the Chinese authorities have formally detained her and four other activists for ""creating disturbances."" They also briefly detained some of the activists' supporters, raided a prominent nongovernmental organization that called for their release, and have at points denied some of the women access to medical treatment, lawyers and adequate rest. The fate of the five will be revealed by April 13, as their case reaches the legal time limit when they must either be released or ""formally arrested,"" which almost always leads to conviction in China's legal system.",0.2755833864212036
12a3eec84bff4a1cfa3391479c9a259ecca5741b,"Astrophysicist Amy Mainzer says she was was touched by Malala's story of determination .
Mainzer also works on educating children about science .","(CNN)Malala Yousafzai's stellar career has included a Nobel Peace Prize. Last week, she made it into outer space. A NASA astrophysicist has named an asteroid after the teenage education activist from Pakistan, who was gravely wounded by a Pakistani Taliban gunman for promoting the right of girls' to go to school.",0.26938188076019287
4bd20bce9066eb3e0950299a340faa935026fe5a,"Emy Afalava is a loyal American and decorated veteran; he's also an American Samoan .
Sam Erman and Nathan Perl-Rosenthal: It is outrageous that he and others like him are denied citizenship .","(CNN)Emy Afalava is a loyal American and decorated veteran. He was born in American Samoa, a U.S. territory since 1900.",0.35177600383758545
578677b3280b0f5ab8b45fdd948707262c9ffed3,"April 8, 2014, the WHO finally started reporting the Ebola epidemic was a ""concern""
Front line health care workers and Ebola survivors say the world has to act quicker .","(CNN)Over the last year more than 25,000 people, a population about the size of Key West, Florida, have fought Ebola infections. More than 10,000 have not survived. But for those who have survived, life will never be the same.",0.19447006285190582
be5d8524bf21d485e203425d764ed60a3bf71b8d,"Attorney General Holder reiterates Justice Department policy on prostitutes .
Soliciting prostitutes is banned, even in places where it's legal, Holder says .
His memo comes weeks after a report involving DEA agents and prostitutes .","(CNN)No prostitutes. No ifs, ands or buts -- and yes, that includes when and where prostitution is perfectly legal. That was the message Friday from Attorney General Eric Holder to members of the U.S.",0.21672572195529938
574767c29dfee14ea227639f45387c07437a55e5,"Nashville's district attorney banned prosecutors from offering female sterilization in plea deals .
Danny Cevallos: Present-day sterilization plea deals are voluntary and unlike creepy antiquated practices .","(CNN)Recently, Nashville's district attorney banned prosecutors from offering female sterilization in plea deals. Believe it or not, Nashville prosecutors have offered this option four times in the past five years. There has been public outrage at the notion that a defendant in America in 2015 would be offered a choice of sterilization as part of a plea deal.",0.3231388330459595
2dac7b4a9ed9eb9cfcabae0e8e0eb07abc5b8860,"Haroon Moghul: Tsarnaev found guilty in terrorist bombing of Boston Marathon. How to prevent future such acts by young Muslims?
Pew reports by 2050, one in 4 will be Muslim. Many equate terror with Islam. Not true, but we should grasp what causes radicalization .
Moghul: Muslims see their community besieged around world, some think solution is violence. They must be shown other way to help .","(CNN)After two days of deliberation, jurors found Dzhokhar Tsarnaev guilty on all counts in the Boston Marathon bombing. The verdict isn't surprising. What might be, however, is the answer to how we prevent this kind of violence from happening again.",0.31389838457107544
