id,reference,candidate,bleurt
f001ec5c4704938247d27a44948eebb37ae98d01,"Membership gives the ICC jurisdiction over alleged crimes committed in Palestinian territories since last June .
Israel and the United States opposed the move, which could open the door to war crimes investigations against Israelis .","(CNN)The Palestinian Authority officially became the 123rd member of the International Criminal Court on Wednesday, a step that gives the court jurisdiction over alleged crimes in Palestinian territories. The formal accession was marked with a ceremony at The Hague, in the Netherlands, where the court is based. The Palestinians signed the ICC's founding Rome Statute in January, when they also accepted its jurisdiction over alleged crimes committed ""in the occupied Palestinian territory, including East Jerusalem, since June 13, 2014."" Later that month, the ICC opened a preliminary examination into the situation in Palestinian territories, paving the way for possible war crimes investigations against Israelis.",0.2891079783439636
230c522854991d053fe98a718b1defa077a8efef,"Theia, a bully breed mix, was apparently hit by a car, whacked with a hammer and buried in a field .
""She's a true miracle dog and she deserves a good life,"" says Sara Mellado, who is looking for a home for Theia .","(CNN)Never mind cats having nine lives. A stray pooch in Washington State has used up at least three of her own after being hit by a car, apparently whacked on the head with a hammer in a misguided mercy killing and then buried in a field -- only to survive. That's according to Washington State University, where the dog -- a friendly white-and-black bully breed mix now named Theia -- has been receiving care at the Veterinary Teaching Hospital.",0.2509020268917084
4495ba8f3a340d97a9df1476f8a35502bcce1f69,"Mohammad Javad Zarif has spent more time with John Kerry than any other foreign minister .
He once participated in a takeover of the Iranian Consulate in San Francisco .
The Iranian foreign minister tweets in English .","(CNN)If you've been following the news lately, there are certain things you doubtless know about Mohammad Javad Zarif. He is, of course, the Iranian foreign minister. He has been U.S.",0.2668379545211792
a38e72fed88684ec8d60dd5856282e999dc8c0ca,"17 Americans were exposed to the Ebola virus while in Sierra Leone in March .
Another person was diagnosed with the disease and taken to hospital in Maryland .
National Institutes of Health says the patient is in fair condition after weeks of treatment .","(CNN)Five Americans who were monitored for three weeks at an Omaha, Nebraska, hospital after being exposed to Ebola in West Africa have been released, a Nebraska Medicine spokesman said in an email Wednesday. One of the five had a heart-related issue on Saturday and has been discharged but hasn't left the area, Taylor Wilson wrote. The others have already gone home.",0.25487127900123596
c27cf1b136cc270023de959e7ab24638021bc43f,"Student is no longer on Duke University campus and will face disciplinary review .
School officials identified student during investigation and the person admitted to hanging the noose, Duke says .
The noose, made of rope, was discovered on campus about 2 a.m.","(CNN)A Duke student has admitted to hanging a noose made of rope from a tree near a student union, university officials said Thursday. The prestigious private school didn't identify the student, citing federal privacy laws. In a news release, it said the student was no longer on campus and will face student conduct review.",0.33682796359062195
1b2cc634e2bfc6f2595260e7ed9b42f77ecbb0ce,"College-bound basketball star asks girl with Down syndrome to high school prom .
Pictures of the two during the ""prom-posal"" have gone viral .",(CNN)He's a blue chip college basketball recruit. She's a high school freshman with Down syndrome. At first glance Trey Moses and Ellie Meredith couldn't be more different.,0.24267949163913727
e2706dce6cf26bc61b082438188fdb6e130d9e40,"Amnesty's annual death penalty report catalogs encouraging signs, but setbacks in numbers of those sentenced to death .
Organization claims that governments around the world are using the threat of terrorism to advance executions .
The number of executions worldwide has gone down by almost 22% compared with 2013, but death sentences up by 28% .","(CNN)Governments around the world are using the threat of terrorism -- real or perceived -- to advance executions, Amnesty International alleges in its annual report on the death penalty. ""The dark trend of governments using the death penalty in a futile attempt to tackle real or imaginary threats to state security and public safety was stark last year,"" said Salil Shetty, Amnesty's Secretary General in a release. ""It is shameful that so many states around the world are essentially playing with people's lives -- putting people to death for 'terrorism' or to quell internal instability on the ill-conceived premise of deterrence."" The report, ""Death Sentences and Executions 2014,"" cites the example of Pakistan lifting a six-year moratorium on the execution of civilians following the horrific attack on a school in Peshawar in December.",0.3499395251274109
0d3c8c276d079c4c225f034c69aa024cdab7869d,"Andrew Getty's death appears to be from natural causes, police say, citing coroner's early assessment .
In a petition for a restraining order, Getty had written he had a serious medical condition.
Police say this is not a criminal matter at this time .","(CNN)Andrew Getty, one of the heirs to billions of oil money, appears to have died of natural causes, a Los Angeles Police Department spokesman said. The coroner's preliminary assessment is there was no foul play involved in the death of Getty, grandson of oil tycoon J. Paul Getty, said Detective Meghan Aguilar.",0.3172573447227478
6222f33c2c79b80be437335eeb3f488509e92cf5,"Once a super typhoon, Maysak is now a tropical storm with 70 mph winds .
It could still cause flooding, landslides and other problems in the Philippines .","(CNN)Filipinos are being warned to be on guard for flash floods and landslides as tropical storm Maysak approached the Asian island nation Saturday. Just a few days ago, Maysak gained super typhoon status thanks to its sustained 150 mph winds. It has since lost a lot of steam as it has spun west in the Pacific Ocean.",0.34541016817092896
2bd8ada1de6a7b02f59430cc82045eb8d29cf033,"Bob Barker returned to host ""The Price Is Right"" on Wednesday .
Barker, 91, had retired as host in 2007 .","(CNN)For the first time in eight years, a TV legend returned to doing what he does best. Contestants told to ""come on down!"" on the April 1 edition of ""The Price Is Right"" encountered not host Drew Carey but another familiar face in charge of the proceedings. Instead, there was Bob Barker, who hosted the TV game show for 35 years before stepping down in 2007.",0.24812081456184387
ee17dfb574feca82ccac5689595e47483bd23f12,"London's Metropolitan Police say the man was arrested at Luton airport after landing on a flight from Istanbul .
He's been charged with terror offenses allegedly committed since the start of November .","London (CNN)A 19-year-old man was charged Wednesday with terror offenses after he was arrested as he returned to Britain from Turkey, London's Metropolitan Police said. Yahya Rashid, a UK national from northwest London, was detained at Luton airport on Tuesday after he arrived on a flight from Istanbul, police said. He's been charged with engaging in conduct in preparation of acts of terrorism, and with engaging in conduct with the intention of assisting others to commit acts of terrorism.",0.3828281760215759
384175be1c8d41610fbeddbd9d9cb46e716e2529,"""Furious 7"" pays tribute to star Paul Walker, who died during filming .
Vin Diesel: ""This movie is more than a movie""
""Furious 7"" opens Friday .","(CNN)Paul Walker is hardly the first actor to die during a production. But Walker's death in November 2013 at the age of 40 after a car crash was especially eerie given his rise to fame in the ""Fast and Furious"" film franchise. The release of ""Furious 7"" on Friday offers the opportunity for fans to remember -- and possibly grieve again -- the man that so many have praised as one of the nicest guys in Hollywood.",0.30083292722702026
203886369feea77bbc35715e6d7e518b751f57de,"Museum: Anne Frank died earlier than previously believed .
Researchers re-examined archives and testimonies of survivors .
Anne and older sister Margot Frank are believed to have died in February 1945 .","(CNN)Seventy years ago, Anne Frank died of typhus in a Nazi concentration camp at the age of 15. Just two weeks after her supposed death on March 31, 1945, the Bergen-Belsen concentration camp where she had been imprisoned was liberated -- timing that showed how close the Jewish diarist had been to surviving the Holocaust. But new research released by the Anne Frank House shows that Anne and her older sister, Margot Frank, died at least a month earlier than previously thought.",0.3097362816333771
1dd00c89d71a5611797bb34da8a6eada8f058405,"LZ: Indiana law pushing back LGBT rights, and other states' anti-LGBT moves, bow to far right wing that GOP candidates need for 2016 .
Cruz, Huckabee, Jindal, Carson, Walker are reviving culture wars, he says.  Equality for LGBT has not yet ""won"" in America .","(CNN)A year ago Bloomberg published a story with the following headline: Mike Pence, a Koch Favorite, Mulls 2016 Run for President. The story ticked off items on Pence's conservative things-to-do list while also noting his close ties to the deep-pocketed Koch brothers, as well as other right-wing lobbying groups. Last August the Indiana governor was in Dallas for an Americans for Prosperity event; the group is backed by the conservative Koch brothers, and supported Gov.",0.20006439089775085
eeafdc8b2d8130cabda5aafe352eab1198d0b9f8,"Singing the national anthem is a risky proposition .
Whitney Houston nailed it; Roseanne Barr destroyed it .","(CNN)If you're famous and performing the American national anthem, be prepared to become a national hero or a national disgrace. Facts are facts. Just ask Vince, Whitney, Roseanne, Jimi and Michael.",0.2550238370895386
dc833f8b55e381011ce23f89ea909b9a141b5a66,"While Republican Gov. Asa Hutchinson was weighing an Arkansas religious freedom bill, Walmart voiced its opposition .
Walmart and other high-profile businesses are showing their support for gay and lesbian rights .
Their stance puts them in conflict with socially conservative Republicans, traditionally seen as allies .","(CNN)As goes Walmart, so goes the nation? Everyone from Apple CEO Tim Cook to the head of the NCAA slammed religious freedom laws being considered in several states this week, warning that they would open the door to discrimination against gay and lesbian customers. But it was the opposition from Walmart, the ubiquitous retailer that dots the American landscape, that perhaps resonated most deeply, providing the latest evidence of growing support for gay rights in the heartland.",0.22478899359703064
c222979bd1cfbc7d3ff821e9c738e3dbd29b14f4,"Amnesty International releases its annual review of the death penalty worldwide; much of it makes for grim reading .
Salil Shetty: Countries that use executions to deal with problems are on the wrong side of history .","(CNN)On May 28, 2014, some 7,000 people gathered in a stadium in China's northwestern Xinjiang region. But they had not come to watch the local football team or any other grand sporting event. Instead, the authorities paraded scores of prisoners dressed in orange jumpsuits.",0.1427079141139984
469c6ac05092ca5997728c9dfc19f9ab6b936e40,"Marseille prosecutor says ""so far no videos were used in the crash investigation"" despite media reports .
Journalists at Bild and Paris Match are ""very confident"" the video clip is real, an editor says .
Andreas Lubitz had informed his Lufthansa training school of an episode of severe depression, airline says .","Marseille, France (CNN)The French prosecutor leading an investigation into the crash of Germanwings Flight 9525 insisted Wednesday that he was not aware of any video footage from on board the plane. Marseille prosecutor Brice Robin told CNN that ""so far no videos were used in the crash investigation."" He added, ""A person who has such a video needs to immediately give it to the investigators."" Robin's comments follow claims by two magazines, German daily Bild and French Paris Match, of a cell phone video showing the harrowing final seconds from on board Germanwings Flight 9525 as it crashed into the French Alps. All 150 on board were killed.",0.2712932527065277
88e7dac40f3e6c159e4edc0747d0cc0f50886fbb,"The Rev. Robert Schuller, 88, had been diagnosed with esophageal cancer in 2013 .
His TV show, ""Hour of Power,"" was enormously popular in the 1970s and 1980s .","(CNN)The Rev. Robert H. Schuller, California televangelist and founder of the television ministry ""Hour of Power,"" died Thursday, according to his family.",0.2511928677558899
ec4b5fef725b4cc81545689603ff84c8e19bd6dc,"Former GOP representative compares President Obama to Andreas Lubitz .
Bachmann said with possible Iran deal, Obama will fly ""entire nation into the rocks""
Reaction on social media? She was blasted by Facebook commenters .","(CNN)Michele Bachmann is comparing President Obama to the co-pilot of the doomed Germanwings flight. ""With his Iran deal, Barack Obama is for the 300 million souls of the United States what Andreas Lubitz was for the 150 souls on the German Wings flight - a deranged pilot flying his entire nation into the rocks,"" the Minnesota Republican and former representative wrote in a Facebook comment posted March 31. ""After the fact, among the smoldering remains of American cities, the shocked survivors will ask, why did he do it?"" Andreas Lubitz, the co-pilot of Germanwings Flight 9525, is accused by authorities of deliberately crashing the plane in the French Alps.",0.28805866837501526
ffff11a2f44d731cd80c86819a89b7e227581415,"Father: ""I know he went through what he went through""
Louis Jordan was found on his sailboat, which was listing and in bad shape, rescuer says .
He appears to be in good shape, physically and mentally .","Norfolk, Virginia (CNN)The second mate of the Houston Express probably couldn't believe what he was seeing. Hundreds of miles from land there was a small boat nearby. At first it looked abandoned.",0.1856638491153717
c7caf9181c2e94a79d9102da6e11cde48c880aa5,"Richard Klass: Iran framework agreement on nukes is strong, but opponents will cast doubts on this and try to obscure its facts .
He says the deal would cut uranium stockpile, centrifuges, implement rigorous inspections; it should be judged on merits, not disinformation .","(CNN)The United States and its negotiating partners reached a very strong framework agreement with Iran in Lausanne, Switzerland, on Thursday that limits Iran's nuclear program in such a way as to effectively block it from building a nuclear weapon. Expect pushback anyway, if the recent past is any harbinger. Just last month, in an attempt to head off such an agreement, House Speaker John Boehner invited Israeli Prime Minister Benjamin Netanyahu to preemptively blast it before Congress, and 47 senators sent a letter to the Iranian leadership warning them away from a deal.",0.19094042479991913
b21cd549314996de79ba0ca2636c8ced66468267,"Americans paid more for some fruits and vegetables last year because of the drought .
Tourists will now have to ask for a glass of water at a California restaurant .
Perhaps the only good thing is another ""great"" wine grape harvest last year .","Los Angeles (CNN)It's more than just one state's internal problem. The historic California drought hurts the rest of the union, too. That's because California is a breadbasket to the nation, growing more than a third of its vegetables and nearly two-thirds of its fruits and nuts.",0.2061367928981781
17412737648b2cad59669560765fcb5169fc8116,"The FBI cites social media messages sent by Keonna Thomas, 30 .
She's accused of trying to travel overseas to join ISIS .
Thomas is one of three women facing federal terror charges this week .",(CNN)The FBI charged a Philadelphia woman on Thursday with trying to travel overseas to fight for ISIS. She's one of three women arrested this week on terror charges. Two New York women were also taken into custody.,0.40148288011550903
970f75d6e5b23e11c15b05c59a109ccbb160b289,"Iranian sports official: The ban will be lifted for some events in the coming year .
But he says ""families are not interested in attending"" some sports matches .","(CNN)Since Iran's Islamic Revolution in 1979, women have been barred from attending most sports events involving men. But the situation appears set to improve in the coming months after a top Iranian sports official said that the ban will be lifted for some events. A plan to allow ""women and families"" to enter sports stadiums will come into effect in the next year, Deputy Sports Minister Abdolhamid Ahmadi said Saturday, according to state-run media.",0.3767378330230713
9f051fe922a8f45b315a366a5af1aab58d93f050,"Going online has become the path of least resistance if you want to make yourself heard .
But where there is the restrictive rule of law, journalists are vulnerable to the anger of officialdom .
From China to Malaysia, journalists and bloggers have been jailed -- even killed .","(CNN)Just as mimeograph machines and photocopiers were in their day, online activity -- blogs, YouTube channels, even social media platforms like Facebook and Twitter -- have fully emerged as the alternative to traditional mainstream media. It is not just the low cost of posting online that attracts dissidence, though that in itself is liberating. It is the lack of access to traditional print and broadcast media in authoritarian countries that is really the driving force leading disaffected voices to post online.",0.2344304323196411
202a51397a4de6483e6a7427d1952c46fca69d81,"The singer had been off the scene for a while .
She says she was bedridden for months .
Lavigne was sometimes too weak to shower .","(CNN)When singer Avril Lavigne went missing from the music scene, there was tons of speculation. Was she pregnant? In rehab?",0.2563631534576416
2f6106809de41d59f422d527900a6b344174c5b2,"Here are six of CNN's best videos of the week .
Clips include a look at Mike Tyson's abandoned mansion .","(CNN)A trip to a former heavyweight champ's gaudy, abandoned mansion. The tallest and fastest ""giga-coaster"" in the world. A dramatic interview with a famed spiritual leader -- and the tearful reaction by one of his former students.",0.2514595091342926
9a2ffa6ad643d52e6b99b0b08e497f41ba23b2b2,"Netanyahu says third option is ""standing firm"" to get a better deal .
Political sparring continues in U.S. over the deal with Iran .","Washington (CNN)Israeli Prime Minister Benjamin Netanyahu criticized the deal six world powers struck to thwart Iran's nuclear ambitions, saying he sees better options than ""this bad deal or war."" ""I think there's a third alternative, and that is standing firm, ratcheting up the pressure until you get a better deal,"" Netanyahu told CNN's Jim Acosta Sunday on ""State of the Union."" His comments come as Democrats and Republicans spar over the framework announced last week to lift Western sanctions on Iran in exchange for the country dropping from 19,000 to 5,060 active centrifuges, limiting its highly enriched uranium, and increasing inspections. President Barack Obama endorsed the deal, saying it was better than the alternatives. But GOP contenders for the party's 2016 presidential nomination lambasted it, saying it gave Iran too much flexibility.",0.28061866760253906
f78024d271fd21f0667f5da6843516314af71f8f,"Indiana town's Memories Pizza is shut down after online threat .
Its owners say they'd refuse to cater a same-sex couple's wedding .",(CNN)Standing up for what you believe. What does it cost you? What do you gain?,0.1336502879858017
63e19d477469e39e3fc4143919e6a5acb58dbc23,"Authorities in the Indian city of Malegaon have asked residents to take a 'mugshot' of their cattle .
Cows are revered by the majority Hindu population, and many parts of the country have laws banning the slaughter of cattle .
Officials in Malegaon believe this is the best way to solve cow slaughter cases and enforce the law .","(CNN)Police in the Indian city of Malegaon, in the western state of Maharashtra, are requiring identity cards for an unusual group of residents: Cattle. Following a recent state-wide ban on the sale and consumption of beef, authorities in the city have asked residents to take a 'mugshot' of their cattle and submit it to the police. Along with the photograph, the residents have to give information about their animal's 'unique features,' such as the coloring and age of the cow, along with the length of its tail and other distinctive characteristics.",0.346477210521698
cf7094270cbb4c8fad5029bd2c2da694f1411870,"A South Carolina man says he spent 66 days alone at sea before being rescued .
Other sole survivor stories include a Japanese man washed away by a tsunami .
An El Salvador man says he drifted from Mexico to Marshall Islands over a year .","(CNN)It's the kind of thing you see in movies, like Robert Redford's role in ""All Is Lost"" or Ang Lee's ""Life of Pi."" But, in real life, it's hard to swallow the idea of a single person being stranded at sea for days, weeks, if not months and somehow living to talk about it. Miracles do happen, though, and not just in Hollywood. We're not talking about people who float aimlessly or run aground after running out of gas or being let down by faltering winds only to be picked up a few hours later by the U.S.",0.1873929351568222
934a2d9235022c9e8a6aeec5e7e941b127569b76,"The Large Hadron Collider (LHC) begins again after a two-year shutdown .
The restart was delayed in March .","(CNN)The world's biggest and most powerful physics experiment is taking place as you read this. The Large Hadron Collider (LHC), a particle accelerator and the largest machine in the world, is ready for action following a two-year shutdown. After problems that delayed the restart in March, scientists at the European Organization for Nuclear Research (CERN) completed final tests, enabling the first beams to start circulating Sunday inside the LHC's 17 mile (27 km) ring.",0.32186755537986755
82461522ee90f8f5be2ec226e2016ad40588866d,"FBI agents and a suspected serial robber exchange gunfire in an FBI stakeout .
Two FBI agents are injured and the suspect is shot during the gunfight .","Atlanta (CNN)It was a scene worthy of any top cop show on TV -- bullets flying, banged-up cars and the FBI chasing an armed robbery suspect. In the end, two agents were injured in a crash and the suspect was shot before being captured. FBI agents and task force officers were following 36-year-old Kevone Charleston of Austell, Georgia, as he pulled into a CVS pharmacy in Forsyth County, Georgia, early Saturday.",0.2505151331424713
37477ed1fc065f438021ee3b6d3e2b827e270353,"The total eclipse will only last 4 minutes and 43 seconds .
People west of the Mississippi River will have the best view .
Parts of South America, India, China and Russia also will see the eclipse .",(CNN)Sky watchers in western North America are in for a treat: a nearly five-minute total lunar eclipse this morning. Here's how it's unfolding: . It started at 3:16 a.m.,0.2325618416070938
4fbf675fb79046440d1cf01dd4fc2e505f2b5169,"Terrorist group Al-Shabaab has attacked a Kenyan college, killing and taking hostages .
It is a clear indicator the security situation in East Africa is deteriorating, says Stefan Wolff .
More than military action aloe is needed to combat terrorism in the region, he says .","(CNN)The terrorist group Al-Shabaab has claimed an attack on Garissa University College in eastern Kenya, in which many people have been killed and still more taken hostage. The attack is another step in the ongoing escalation of the terrorist group's activities, and a clear indicator that the security situation in East Africa is deteriorating fast. Somalia-based Al-Shabaab has been behind a string of recent attacks in Kenya, the most well-known of them being the massacre at the Westgate Shopping Centre in Nairobi in 2013.",0.38723307847976685
c5390093fa60d62c4dc9013977ca09a8edf7c32b,"Easter is a key event in the Christian faith, but where did the Easter Bunny come from?
Why is the date different every year, and what does it have to do with the moon?","(CNN)Easter is a cornerstone event in the Christian faith, but it's surrounded by interesting quirks. It celebrates the completion of Christ's mission of salvation in the Crucifixion and Resurrection. By dying on Good Friday, Christ atoned for the sins of others; by rising from the grave on Sunday, Christ conquered death.",0.3314606547355652
