id,reference,candidate,bleurt
41592d02ca324abe370ff063962b97ca5d976e73,"Some of Jesus' most important financial backers were women, historians say.
Joseph of Arimathea and Nicodemus, both men of stature and wealth, chipped in to help fund Jesus' ministry.","(CNN)""Sell all that you own and distribute the money to the poor, and you will have treasure in heaven; then come, follow me,"" Jesus tells the rich man in one of his best-known parables. It was a mantra he invoked repeatedly: the poor were blessed, and it was easier for a camel to pass through the eye of a needle than it was for the well-to-do to enter paradise. Meanwhile, Jesus told his Twelve Apostles to leave their day jobs and follow him on an itinerant mission with few prospects of success and no visible means of support.",0.2652347981929779
2b4eb5a283f51b54e1b0318936ae9bcfa70ce243,"Three people killed; five wounded in attack on attorney general's office in Balkh province .
Staff and civilians have been rescued as gunmen engaged Afghan security forces .","Kabul, Afghanistan (CNN)Three people were killed and five others were wounded Thursday afternoon when a group of armed assailants stormed into the attorney general's office in Balkh province, northern Afghanistan, according to a press release from the provincial governor's office. Although most staff members and civilians have been rescued, an exchange of fire between Afghan security forces and the assailants is ongoing, the statement says. Two police officers and a security guard of the provincial attorney general's office were among the dead.",0.415796160697937
69af3b9fc4ba1fa6bd272c82d17ec318da5ff97a,"Georgia Powers: Rand Paul, running for president, would like minorities to think he's an advocate. His record on rights shows otherwise .
On civil rights, women's choice, voting rights, immigrant DREAMers, education, he has shown he'd take country backwards, she says .","(CNN)When I was elected to the Kentucky State Senate in 1967, I became the first woman and the first person of color to serve in the body. Five decades later, I find it almost unfathomable that a politician from my own state is attempting to launch his presidential campaign on a record that includes questioning landmark voting rights and civil rights legislation. But that is what Rand Paul, who today declared he's running for president of the United States, is doing.",0.19807162880897522
76a518ad3aa590fbac1b9e6e68634fe4709270ed,"Network regains control of Facebook page and one of its 11 channels .
ISIS logos displayed but no claim of responsibility made by any group .
Network reaches 260 million homes worldwide .","(CNN)A French-language global television network regained control of one of its 11 channels Thursday after a cyberattack a day earlier crippled its broadcasts and social media accounts. Television network TV5Monde was gradually regaining control of its channels and social media outlets after suffering what the network's director called an ""extremely powerful cyberattack."" In addition to its 11 channels, TV5Monde lost control of its social media outlets and its websites, director Yves Bigot said in a video message posted later on Facebook. On a mobile site, which was still active, the network said it was ""hacked by an Islamist group."" ISIS logos and markings appeared on  TV5Monde social media accounts.",0.27612993121147156
ff9c1536bfa6ee669b800b6e9db04d9a9751dda1,"Couple spends $1,200 to ship their cat, Felix, on a flight from the United Arab Emirates .
Felix went missing somewhere at John F. Kennedy International Airport, airline says .
Pets are ""treated no differently than a free piece of checked luggage,"" Jennifer Stewart says .","Abu Dhabi, United Arab Emirates (CNN)Lost luggage after a long flight is a common, frustrating occurrence of modern air travel. And sometimes, airlines lose things that are irreplaceable. American Jennifer Stewart says she was devastated to learn that Etihad Airways lost her most important baggage following a recent trip from Abu Dhabi to New York City: her 2-year-old pet cat, Felix.",0.25316864252090454
7b8bb308a48e838c9d7f3fee08d4670efd305463,"The trials of Dzhokhar Tsarnaev and Aaron Hernandez are coming to a close .
Voting has put Rahm Emanuel and Ferguson, Missouri, back in the headlines .
Rand Paul has announced his bid for the presidency .",(CNN)The nation's top stories will be unfolding Tuesday in courthouses and political arenas across the country. Massachusetts is hosting two of the highest-profile court trials in recent memory -- those of former New England Patriot Aaron Hernandez and Boston bombing suspect Dzhokhar Tsarnaev. Both lengthy trials are coming to a close.,0.23676787316799164
43f18fc9b20fe64405d7f18a08fb8d9ef932ed8b,"Fire breaks out at the General Electric Appliance Park in Louisville, Kentucky .
City official: No is believed to be injured or trapped .","(CNN)A mammoth fire broke out Friday morning in a Kentucky industrial park, sending plumes of thick smoke over the area as authorities worked to contain the damage. The blaze began shortly before 7 a.m. at the General Electric Appliance Park in Louisville, according to Mike Weimer from the city's emergency management agency.",0.27569541335105896
72df456684b62acd43db2ac9bb23f509b9b53942,"Ted Cruz has built a brand as a stalwart conservative on fiscal issues .
But he's also eager to champion social issues at a time when many Republicans are eager to avoid them .
Cruz says the GOP needs to unite young libertarian-minded voters and evangelicals .","Cedar Falls, Iowa (CNN)As aides politely tried to rush Ted Cruz from an event in Cedar Falls to one in Cedar Rapids, Iowa, on Thursday, the presidential candidate continued shaking hands with anyone who wanted to meet him. Finally, after the selfies and conversations started to die down, his aides managed to move him closer to the door when a tall, burly man stopped him. ""Senator,"" he said, ""can I pray with you real quick?"" ""Yeah,"" Cruz said, as he clasped the man's upper arm and the two bowed their heads.",0.18499507009983063
e67604ecb75aa21391e1d15a577d16b8db990de5,"Kenyans use hashtag #147notjustanumber to honor victims of Kenya university attack .
The attack killed 142 students, three security officers and two university security personnel .",(CNN)One hundred and forty-seven victims. Many more families affected. Even more broken hopes and dreams.,0.2125052809715271
41c6edecee127c396d17e2e9115a4a89252cc52b,"The penalty is more than 10 times the previous record, according to a newspaper report .
Utility commission to force Pacific Gas & Electric Co. to make infrastructure improvements .
Company apologizes for explosion that killed 8, says it is using lessons learned to improve safety .","(CNN)The California Public Utilities Commission on Thursday said it is ordering Pacific Gas & Electric Co. to pay a record $1.6 billion penalty for unsafe operation of its gas transmission system, including the pipeline rupture that killed eight people in San Bruno in September 2010. Most of the penalty amounts to forced spending on improving pipeline safety.",0.3302660584449768
947b339a524aac1f43384a8c68e5a3a624ed309f,"Dzhokhar Tsarnaev is found guilty on all 30 charges he faced .
Seventeen counts were capital charges, meaning he is eligible for the death penalty .","Boston (CNN)Guilty across the board. But will he face death? After deliberating for 11 hours, jurors found Dzhokhar Tsarnaev guilty on Wednesday of all 30 counts he faced in the Boston Marathon bombing trial.",0.2903892397880554
8911c07945c382306d5aba8cf6c513c0c8ce61d0,"The fire on a platform in the Gulf of Mexico has been extinguished, Pemex says .
45 workers were injured in the blaze, according to the state oil company .
Four workers were killed in the oil rig fire, which started early Wednesday .","(CNN)Four workers died in a massive oil rig fire that raged for hours off the coast of Mexico Wednesday. Mexican state oil company Pemex said 45 workers were injured in the blaze, which began early Wednesday morning. Two of them are in serious condition, the company said.",0.45924675464630127
b8e56b3cb5faa8d68341738b5708168e5cf18e2f,"Jay Parini: When religious identity, ethics, tolerance are roiling the culture, it's worth looking at message of Holy Week and Easter .
He says ritual enactment of these three days is reminder that again and again the human condition moves through darkness into light .","(CNN)Easter is unique on the Christian calendar, a major point in the cycle of the religious year, and one that has always been able to resist the commercialization and culture warring that surrounds Christmas. That's in part because Easter is genuinely about how religious impulses, and patterns, can operate in ways that affect our lives. Nevertheless, I'm often surprised by how little people, even those supposedly within the Christian tradition, actually know about what is called Holy Week and its culmination on Easter Sunday.",0.3270258903503418
63ee59d69982f3f73bb33da9880747c8138dbea4,"Police in Lucknow, northern India, have bought four drones to help control crowds .
The unmanned aerial vehicles are being fitted with cameras and pepper spray to subdue angry protesters .
Some Indians have questioned why police are resorting to ""authoritarian and forceful methods""","(CNN)Police in India are putting aside their batons in favor of an overhead solution to angry and unruly crowds: pepper-spraying drones. Yashasvi Yadav, Senior Superintendent of police in Lucknow, northern India, told CNN the city's force has bought four drones and is in the process of purchasing one more. ""The drones have been tested in controlled conditions,"" he said.",0.40507203340530396
ff42fad959e8b522b562b7b715c8d558270a79f2,"Secret Service says supervisor's security clearance has been suspended .
He is accused of trying to kiss a colleague .","(CNN)Just as the agency begins to recover from a series of high-profile missteps, the Secret Service is facing yet another scandal. A female employee accused Xavier Morales, a supervisor within the agency, of assault after he made sexual advances at  her, according to The Washington Post. ""The woman told police and agency investigators that Morales, her boss, told her during the party at Capitol City Brewing Company that he was in love with her and would like to have sex with her,"" and later tried to kiss her in the office, according to a report from The Washington Post.",0.2867982089519501
3cf7f404fef8bef1cc9dab35b6931647a83c7ccd,"""All the police investigators have left the (Germanwings) crash site,"" a police official says .
Private security company is ensuring no one goes on the site, official says .
Authorities say co-pilot Andreas Lubitz deliberately crashed the plane, killing all 150 on board .","Marseille, France (CNN)Investigators have collected all the main evidence from the site where Germanwings Flight 9525 crashed, a French national police official told CNN on Saturday. Investigators are not expected to return to the crash site, said Capt. Yves Naffrechoux of the High Mountain Gendarmerie.",0.23009014129638672
a8c1b6fc67380b8b4a542a6a2512a2f3c2d07d45,"April 8 was huge for ""Lost"" and ""Empire Records"" fans .
April 14, April 25, October 21 are other big dates in movies .","(CNN)Pardon us, ""Lost"" fans, but April 8 wasn't only your day. Yes, we know the significance of April 8, 2015, and the alignment of 4:23.42 p.m. on that date to everyone obsessed with the hit ABC show, and we heard about the general geek-outs that were occurring.",0.22924035787582397
cb56840e21bbf8a71cd0337b5908d3f783862ae0,"Twisted Sister's 2016 tour will be its last .
Band will celebrate 40 years in 2016 .
Twisted Sister drummer A.J. Pero died in March .","(CNN)They're not gonna take it anymore. Really. Twisted Sister says that its 2016 tour will be its last, according to a press release.",0.2609369456768036
afd04a7bf645f376ba6d6ba5880a4725431793c1,"The film will premiere on Memorial Day .
It opened last year's Cannes Film Festival .
A planned March theater release was scrubbed .","(The Hollywood Reporter)""Grace of Monaco,"" starring Nicole Kidman as star-turned-princess Grace Kelly, is heading straight to Lifetime. The critically-panned film, which opened last year's Cannes Film Festival, will premiere on Lifetime on Memorial Day, May 25. After the movie performed poorly in its international engagements, The Weinstein Co., which first purchased U.S.",0.23374171555042267
32f8af7757d529a19067a7a375316a0f5440c037,"At least one person died as a result of storms in Illinois, an official says .
Fire department: Rescuers searching for trapped victims in Kirkland, Illinois .","(CNN)In her 40 years living in Rochelle, Illinois, Cathy Olson had never seen a tornado that big. ""I saw the top of the funnel cloud, and it was absolutely massive,"" she said. She watched the hulking gray twister grind past her town Thursday, tearing up its fringes.",0.17913857102394104
5362f24162b3ed6f36037319ee66fbaaddc50650,"More questions than answers emerge in controversial S.C. police shooting .
Officer Michael Slager, charged with murder, was fired from the North Charleston Police Department .","(CNN)Eyewitness video showing white North Charleston police Officer Michael Slager shooting to death an unarmed black man has exposed discrepancies in the reports of the first officers on the scene. Slager has been fired and charged with murder in the death of 50-year-old Walter Scott. A bystander's cell phone video, which began after an alleged struggle on the ground between Slager and Scott, shows the five-year police veteran shooting at Scott eight times as Scott runs away.",0.3218801021575928
a2b66e4376258cd41604d654a395f7540d2e8514,"The rapper assaulted the photographer at Los Angeles International Airport in 2013 .
West apologized as part of the settlement, the photographer's lawyer says .","(CNN)Kanye West has settled a lawsuit with a paparazzi photographer he assaulted -- and the two have shaken on it. The photographer, Daniel Ramos, had filed the civil suit against West  after the hip-hop star attacked him and tried to wrestle his camera from him in July 2013 at Los Angeles International Airport. West pleaded no contest last year to a misdemeanor count of battery over the scuffle.",0.28297561407089233
646cba2e8b30945a2079ec4c671740d5db5676e2,"Manuscript of ""American Pie"" lyrics is sold to unnamed buyer for $1.2 million .
Douglas Brinkley: The song, a talisman for its age, brings joy to people 44 years later .","(CNN)""A long, long, time ago..."" Those five words, when uttered or sung, makes baby boomers immediately think of Don McLean's pop masterpiece ""American Pie.""  It's hard to believe that his phenomenal 8 minute allegory, which millions of Americans know by heart, is 44 years old. All sorts of historical cross-currents play off each other in this timeless song, brilliantly gilded with the unforgettable chorus, which starts as ""Bye, Bye, Miss American Pie."" There is no real way to categorize McLean's ""American Pie"" for its hybrid of modern poetry and folk ballad, beer-hall chant and high-art rock. On Tuesday, Christie's sold the 16-page handwritten manuscript of the song's lyrics for $1.2 million to an unnamed buyer.",0.2690299451351166
dd4f726200355d742f631777aaa7b265533c0baf,"Letourneau Fualaau had a sexual relationship with her student .
He was 13 when they began the relationship in 1996 .
In May, they will celebrate their 10th wedding anniversary .","(CNN)Their relationship led to jail time for her, but Mary Kay Letourneau Fualaau wants the world to know that she and her husband, Vili Fualaau, are still happily together. She was a married 34-year-old teacher and mother of four in Seattle in 1996 when she began an affair with Fualaau, her 13-year-old student. Letourneau gave birth to her young lover's child and went on to serve more than seven years in prison on charges related to their sexual relationship.",0.2679477334022522
33cab1f129c3b1f6578e597ea1a278a0c8338965,"Don McLean's ""American Pie"" lyrics auctioned for $1.2 million .
The song is dense with symbolism; McLean says lyrics, notes will reveal meaning .
""Pie"" is McLean's biggest hit, was No. 1 in 1972 .","(CNN)That's some rich ""American Pie."" The lyrics to the famed Don McLean song sold for $1.2 million Tuesday morning at an auction held by Christie's. ""Don McLean's manuscript of 'American Pie' achieved the 3rd highest auction price for an American literary manuscript, a fitting tribute to one the foremost singer-songwriters of his generation,"" Christie's Tom Lecky said in a statement. McLean told Rolling Stone that it was time to part with the manuscript.",0.29684728384017944
f78fb08d7ccc8bf7d4a376d5a885c5ab54026a6f,"Mindy Kaling's brother Vijay Chokalingam pretended to be black to get into med school .
Jeff Yang: That's offensive and ironic, considering that minorities experience many disadvantages .","(CNN)You may know Mindy Kaling from Fox's cult hit comedy ""The Mindy Project,"" in which she plays Mindy Lahiri, a perky, quirky OB/GYN juggling her career and love life in New York. (Only in the Big Apple can a doctor not afford an apartment!) The show was a breakthrough for on-screen representation  the first network sitcom created by and starring a woman of color  and it looks likely to be renewed for the coming 2015-16 season. Recently, however, Kaling's brother Vijay Chokalingam unveiled a project of his own, and while it has been getting a lot of attention, it hasn't generated quite as many laughs  either from observers or from his famous sibling, who told him it brought ""shame upon their family."" You see, Chokalingam revealed that, as an undergraduate at the University of Chicago, he engaged in a daring (his view) or ridiculous and offensive (pretty much everyone else) scam: He applied to medical school claiming to be African-American.",0.331476628780365
cc86a588b4e4e038e2591c363b4b895e46edbeda,"The actor says he's not planning on seeing the buzzed-about documentary .
He called Scientology ""brilliant""
Travolta credits the church with helping him deal with his son's death .","(CNN)Buzz has surrounded HBO's new documentary ""Going Clear: Scientology and the Prison of Belief,"" but Scientologist John Travolta is not a fan. Travolta told the Tampa Bay Times that he has not seen the documentary, ""and I don't really care to."" ""I've been so happy with my (Scientology) experience in the last 40 years that I really don't have anything to say that would shed light on (a documentary) so decidedly negative,"" Travolta said. The actor, one of the Church of Scientology's most high-profile members along with stars like Tom Cruise and Kirstie Alley, is premiering his new film, ""The Forger,"" in Clearwater, Florida.",0.23617340624332428
f1c555fe64f94df1f8c6afecf1ae4c0d78f6efa8,"Anthony Ray Hinton goes free Friday, decades after conviction for two murders .
Court ordered new trial in 2014, years after gun experts testified on his behalf .
Prosecution moved to dismiss charges this year .","(CNN)Anthony Ray Hinton is thankful to be free after nearly 30 years on Alabama's death row for murders he says he didn't commit. And incredulous that it took so long. Hinton, 58, looked up, took in the sunshine and thanked God and his lawyers Friday morning outside the county jail in Birmingham, minutes after taking his first steps as a free man since 1985.",0.2552923858165741
2c05ddcc2bf50bd20dfc8c16f124d32867075b32,"B.B King is now out of the hospital and back at home .
Bluesman suffered from dehydration and exhaustion after a 2014 show in Chicago .
B.B. is short for Blues Boy, part of the name he used as a Memphis disc jockey .","(CNN)Blues legend B.B. King was hospitalized for dehydration, though the ailment didn't keep him out for long. King's dehydration was caused by his Type II diabetes, but he ""is much better,"" his daughter, Claudette King, told the Los Angeles Times.",0.19222639501094818
2af3d5505559f8c3d1728dbfac48da66b81af909,"Animal Planet captures Katie the giraffe's labor and delivery .
The new baby wiggles its ears, rises, tries to nurse from its mom .",(CNN)Anyone who has given birth -- or been an observer of the event -- knows how arduous it can be. But to do it live on the Internet? With two hooves sticking out for several minutes in the midst of labor?,0.18938831984996796
f8e429a6906f299a0925f6d70e2570834a7b8dc6,"U.S. official said in February that Iraqi troops could go into Mosul in April or May .
Officials say now that there's no timetable, an invasion could come sooner or later .
They note that recapturing Mosul from ISIS could be a complicated endeavor .","(CNN)Do you remember the talk about plans for Iraqi-led force to try to take back Mosul this spring? Well, you might want to forget it. Nearly three months after a U.S.",0.1916653960943222
cf3f7388c3b51980ead39a8e701c7a4860d9f77c,"The smash hit series ""Game of Thrones"" returns for a fifth season Sunday .
Major story arcs should start to converge this year .","(CNN)Where do you go from here? The fourth season of ""Game of Thrones"" saw massive battles, major deaths (Tywin!) and White Walkers, but what can fans expect Sunday as we head into a fifth season of one of the most popular shows in HBO history? It's the most high-profile premiere yet, airing simultaneously in 170 countries for the first time.",0.24474123120307922
8ba20bec4358b39f84a8a07264f71566bb3c5e8e,"Bi apologizes on social media: ""My personal speech has led to grave social consequences""
Chinese TV star filmed cursing the late Chairman Mao Zedong .
Making disrespectful references to China's leaders in public is still taboo .","(CNN)A popular Chinese television host known for impromptu satire is now the subject of controversy after being caught on camera cursing the late Chairman Mao Zedong. Bi Fujian, who works for state-run China Central Television, was filmed at a dinner party singing a revolutionary song that eulogizes the Communist Party's early years when he started going off script. ""The Communist Party, Chairman Mao.",0.2760757803916931
d8aee1ae4b1130afbf0572a49afc2f5366b181c9,"Survivor Jeff Bauman stresses ""we will never replace the lives that were lost""
A man who was at the finish line is glad Dzhokhar Tsarnaev is now a ""convicted killer""
""Justice has been served today,"" says a once wounded police officer .","(CNN)Rebekah Gregory blinked back tears as she thought about the verdict. It had been almost two years since Dzhokhar Tsarnaev and his brother planted bombs at the Boston Marathon, setting off deadly explosions that wounded her and hundreds of others. In court last month, she testified that one of the blasts on that day in 2013 left her lying in the street, staring at her own bones.",0.2171669602394104
c34d84d38ccfd021ba0b3712dc23feadd455af5b,"Richard Dysart best known for Leland McKenzie in ""L.A. Law""
Dysart had many TV and film roles, including spots in ""Being There"" and ""The Thing""
Actor won Drama Desk award for performance in theatrical ""That Championship Season""","(The Hollywood Reporter)Richard Dysart, the Emmy-winning actor who portrayed the cranky senior partner Leland McKenzie in the slick, long-running NBC drama ""L.A. Law,"" has died. He was 86.",0.2985357642173767
2549d3c10d5bc8ede708af559dd095271e0225e1,"Ed Royce: Best predictor of Iran's future behavior is its past behavior .
New framework keeps Iran's nuclear door well and truly open, he says .","(CNN)The outlines of a nuclear deal with Iran are in place. Unfortunately, it seems like too many in President Barack Obama's administration have forgotten that the only reason this terrorist-supporting state came to the negotiating table in the first place was because of tough sanctions imposed by the U.S. Congress.",0.26412433385849
5a650587a76e9eb9c03612c7064bbee9f552ebec,"U.S., Venezuelan relations threaten to overshadow Obama, Castro meeting .
Venezuelan President says United States moved to oust him; he has the support of the Cuban foreign minister .","(CNN)The VII Summit of the Americas was supposed to be all about the symbolic handshake between the United States and Cuba. But insert Venezuela into the mix and Panama City, Panama, quickly turns into a ""triangle of tension."" Heads of state from 35 countries in the Western Hemisphere have met every three years to discuss economic, social or political issues since the creation of the summit in 1994. Cuba has historically been the wrench in the diplomatic machinery, with some Latin American leaders threatening not to attend the Summit of the Americas if the United States and Canada didn't agree to invite President Raul Castro.",0.21878886222839355
e3f8ceb7a6271bb978b2bb47978054f58390852e,"There are few similarities between Democrats Martin O'Malley and Jim Webb .
But they find themselves in a similar position as long-shot presidential hopefuls .","Waterloo, Iowa (CNN)Martin O'Malley and Jim Webb share little in common. Both Democrats are toying with a presidential run, both are facing long odds in that endeavor, and both shared a stage at the Polk County Democrats Awards Dinner in Des Moines, Iowa, on Friday night. But, as was evident at the dinner, that is where the similarities end.",0.2703523635864258
