id,reference,candidate,bleurt
58b9fcb9a3537d014d3499b0ad4d4123cfd3eac0,"In response to lawsuit, NCAA says it doesn't control quality of education for student-athletes .
But its website emphasizes importance of education, ""opportunities to learn""
Lawsuit claims students didn't get an education because of academic fraud at UNC .","(CNN)After years of making the case that the education of athletes is paramount, the NCAA now says it has no legal responsibility to make sure education is actually delivered. On its website, the NCAA prominently states, ""It's our commitment -- and our responsibility -- to give young people opportunities to learn, play and succeed."" And later, it says that ""in the collegiate model of sports, the young men and women competing on the field or court are students first, athletes second."" But the NCAA is taking a very different position in response to a lawsuit filed by former University of North Carolina athletes. The lawsuit claimed the students didn't get an education because they were caught up in the largest known academic fraud scandal in NCAA history.",0.36147379875183105
44d681105bcab063dfa0c80ce9cf96393677f9cc,"Judge won't allow teen leave hospital before her last chemotherapy treatment .
Attorneys for the teen are deciding whether to appeal .
Cassandra C. is now in remission and is no longer opposed to the chemotherapy treatments .","(CNN)A Connecticut teen who has been forced to have chemotherapy to treat Hodgkin lymphoma will remain in temporary custody of the state for the time being, according to her attorney, Josh Michtom. A Connecticut juvenile court judge issued a written decision Wednesday denying a motion to let the teen, identified in court documents as ""Cassandra C.,"" go home. The judge also denied a motion for visitation.",0.2944401502609253
a43893ac704663476a285673392de84c0c17d4e5,"The song rules the chart for 13th week .
It passes Robin Thicke's ""Blurred Lines""
Song three weeks from potentially tying ""One Sweet Day"" for record .","(CNN)Mark Ronson's ""Uptown Funk!,"" featuring Bruno Mars, is the longest-leading Billboard Hot 100 of the 2010s, ruling the chart for a 13th week. It's also just the 10th single in the Hot 100's entire history to spend at least 13 weeks at No. 1.",0.2405405342578888
f7c2eb465479b965669b81535234e24735915ebf,"High temperatures are recorded on the northern tip of the Antarctica Peninsula .
The World Meteorological Organization will make the final determination .","(CNN)A high temperature of 63.5 degrees Fahrenheit might sound like a pleasant day in early spring -- unless you're in Antarctica. The chilly continent recorded the temperature (15.5 degrees Celsius) on March 24, possibly the highest ever recorded on Antarctica, according to the Weather Underground. The temperature was recorded at Argentina's Esperanza Base on the northern tip of the Antarctica Peninsula, according to CNN affiliate WTNH.",0.24642272293567657
e8c90d557031700caa1afb66dfc85358ef719108,"A Native American from a tribe not recognized by the feds wins the return of his eagle feathers .
An IRS accountant is fired for insisting on carrying a symbolic Sikh knife to work .
A group of Chicago pastors takes on City Hall over its permits for new churches and loses .","(CNN)The United States has seemingly erupted this week about what it means to live your religion, especially in Indiana, where its new Religious Freedom Restoration Act faces a firestorm from critics who say it uses faith as a pretext to discriminate against gay people. Such state laws have been growing ever since the U.S. Religious Freedom Restoration Act became law in 1993, designed to prohibit the federal government from ""substantially burdening"" a person's exercise of religion.",0.16163314878940582
c71b08cede3b6edb662a2f2c95f8b543fa65e405,"Robert Lewis Burns Jr. was part of Lynyrd Skynyrd's original lineup .
His car hit a mailbox and a tree just before midnight .","Atlanta (CNN)Robert Lewis Burns Jr., the original drummer in Southern rock band Lynyrd Skynyrd, died Friday night in a car crash, a Georgia State Patrol spokesman said. Burns, 64, died after his car hit a mailbox and a tree in Cartersville, spokesman James Tallent said. No other cars were involved in the crash, which occurred shortly before midnight.",0.34067320823669434
f9f5d81bc74d6cf6d713d6fa6be4a30427b46e68,"Kim Ki-Jong is charged with attempted murder and assaulting a foreign envoy .
He's accused of stabbing U.S. Ambassador Mark Lippert in the face and arm .
Police said Kim opposed the joint U.S.-South Korean military drills .","Seoul, South Korea (CNN)The man accused of stabbing U.S. Ambassador Mark Lippert in Seoul last month is now charged with attempted murder, a South Korean court official said Wednesday. Kim Ki-Jong has also been charged with assaulting a foreign envoy and business obstruction, the Seoul Central District Court official said.",0.35405391454696655
32a7125a655a052b3ea62350a8e02f0245cc220e,"Hong Kong banker alleged murder case adjourned until May .
The 29-year-old Rurik Jutting is accused of killing two Indonesian domestic workers .","(CNN)When Hong Kong police answered a call in the early hours of a Saturday morning last November, they encountered a grisly scene and an alleged crime that shocked the city. One woman was lying on the floor with cuts to her neck and buttocks. Another was stuffed inside a suitcase on the balcony.",0.20711204409599304
38a207accfb31afc694f16531d23d2cda79ac85d,"Thai Airways subsidiary Thai Smile features Cartoon Network paint job on A320 jet .
Overhead bins, head rests and air sick bags feature characters from Cartoon Network .","(CNN)""Jake the dog and Finn the human. The fun will never end. Adventure Time."" So begins the dreamy theme song intro to the strangely addictive Cartoon Network TV show that's centered around psychedelic characters like the Ice King, Marceline the Vampire Queen and, of course, Jake and Finn.",0.21303722262382507
9bea5cbe9a0184eec4086a08452066dead185173,"Manning is serving a 35-year sentence for leaking thousands of classified documents .
She says she will be using a voice phone to dictate her tweets .","(CNN)Imprisoned soldier Chelsea Manning can now communicate with the world  -- in 140 characters or less. Manning, who is serving a 35-year prison sentence for leaking thousands of classified documents, appears to have joined Twitter this week. In a series of tweets, the prisoner formerly known as Bradley Manning said she will be using a voice phone to dictate her tweets to  communications firm Fitzgibbon Media, which will post them on her behalf.",0.31108981370925903
a2ee2faeb2dc4e5eab43b1d14233c4ac658f0a8f,"Frida Ghitis: President Barack Obama is right to want a deal, but this one gives Iran too much .
She says the framework agreement starts lifting Iran sanctions much too soon .","(CNN)President Barack Obama tied himself to the mast of a nuclear deal with Iran even before he became the Democratic candidate for president. Reaching a good, solid agreement with Iran is a worthy, desirable goal. But the process has unfolded under the destructive influence of political considerations, weakening America's hand and strengthening Iran.",0.3414347767829895
fd0e8622b9ee38d1d6fff2fff59f0566f1a2f8f7,"The final film featuring the late Paul Walker, ""Furious 7"" is opening around the globe this weekend .
It's worldwide debut may approach or cross $300 million by the end of Easter Sunday .","(CNN)Universal's ""Furious 7"" continues to build momentum at the Friday box office for a weekend debut in the $135 million-$138 million range, the largest opening in North America since fall 2013. That includes a projected Friday take of $58 million-$60 million. The final film featuring the late Paul Walker, ""Furious 7"" is opening around the globe this weekend and earned a record-breaking $60 million internationally on Wednesday and Thursday for a possible worldwide debut approaching or crossing $300 million by the end of Easter Sunday.",0.5195115208625793
6302a6cf8564e4bb4753e2dc3dae328f13edae50,"Deion Sanders calls out son for ""hood doughnuts"" comments .
""You're a Huxtable with a million $ trust fund. Stop the hood stuff!""","(CNN)Deion Sanders is such a dad. The NFL legend called out Deion Sanders Jr. on Twitter for saying he only eats ""hood doughnuts."" In response, the elder Sanders -- in front of his 912,000 followers -- reminded his son he has a trust fund, a condo and his own clothing line called ""Well Off."" ""You're a Huxtable with a million $ trust fund.",0.33781182765960693
8012ab9261e117ab47a2759b3c0b628f2a007a82,"An outside review found that a Rolling Stone article about campus rape was ""deeply flawed""
Danny Cevallos says that there are obstacles to a successful libel case, should one be filed .","(CNN)According to an outside review by Columbia Journalism School professors, ""(a)n institutional failure at Rolling Stone resulted in a deeply flawed article about a purported gang rape at the University of Virginia."" The Columbia team concluded that ""The failure encompassed reporting, editing, editorial supervision and fact-checking."" Hardly a ringing endorsement of the editorial process at the publication. The magazine's managing editor, Will Dana, wrote, ""We would like to apologize to our readers and to all of those who were damaged by our story and the ensuing fallout, including members of the Phi Kappa Psi fraternity and UVA administrators and students."" Brian Stelter: Fraternity to 'pursue all available legal action' The next question is: . Can UVA, Phi Kappa Psi or any of the other fraternities on campus sue for defamation?",0.2972087562084198
b10db3ae83abe1eec4236126d9c195ed7db90cc3,"Shibuya ward in Tokyo passes an ordinance that gives same-sex couples some of the rights of married heterosexual couples .
Activists welcome the decision; hope that it will lead to greater equality for LGBT people in Japan .
Recent poll finds most young Japanese open to the idea of gay marriage .","(CNN)One of Tokyo's most prominent districts has taken a small, but potentially significant step to recognizing same-sex unions in Japan. The government of Shibuya ward, one of the capital's most famous shopping and trendy entertainment districts, passed ordinance on Wednesday paving the way for ""partnership certificates"" for same-sex couples, allowing them some of the rights of married heterosexual couples. Same-sex partners who are registered with the district's ward office will be able to hold visitation rights in hospitals and co-sign tenancy agreements.",0.29108738899230957
4cc5744a14d8a07414760b271c1801c670149f68,"A test in Kansas finds listeria in a Blue Bell ice cream cup .
The company announces it is temporarily shutting a plant to check for the source .
Three people in Kansas have died from a listeria outbreak .","(CNN)Blue Bell ice cream has temporarily shut down one of its manufacturing plants over the discovery of listeria contamination in a serving of ice cream originating from that plant. Public health officials warned consumers Friday not to eat any Blue Bell-branded products made at the company's Broken Arrow, Oklahoma, plant. That includes 3-ounce servings of Blue Bell ice cream from this plant that went to institutions in containers marked with the letters O, P, Q, R, S or T behind the coding date.",0.2584304213523865
e2bccd4dec93c9bb7b327827dae004c2d494ec31,"Japan's top military official earnestly revealed that the country's Self Defense Force (SDF) had never encountered a UFO .
Celebrity politician and former wrestler Antonio Inoki had posed a question concerning extraterrestrials to a government committee .","(CNN)The classic video game ""Space Invaders"" was developed in Japan back in the late 1970's -- and now their real-life counterparts are the topic of an earnest political discussion in Japan's corridors of power. Luckily, Japanese can sleep soundly in their beds tonight as the government's top military official earnestly revealed that the country's Air Self Defense Force (ASDF) had never encountered an extraterrestrial unidentified flying object. Responding to a query from flamboyant former wrestler-turned-lawmaker Antonio Inoki, Defense Minister Gen Nakatani told the Diet, Japan's parliament, that his jets had, to date, never come across any UFOs from outer space.",0.27866891026496887
357a3c6ad7f5add7f35198fa68585da8195367b4,"Bombing of targets in central Sanaa smashes residents' windows and doors .
Hundreds killed in less than two weeks; humanitarian situation desperate, agencies say .","(CNN)Residents of central Sanaa, the Yemeni capital, have learned the hard way that key strategic bombing targets are located in their neighborhoods: Detonating ordnance has been shattering their windows and doors. And fighting has killed hundreds of people in less than two weeks. The Saudi-led coalition smashed parts of Yemen's Defense Ministry Central Command in the capital over the weekend, senior Yemeni officials said.",0.34399425983428955
78a670384c908a15617cab7f575fd50dc5999937,"David Lynch says he won't be directing new episodes of Twin Peaks .
Showtime ""saddened"" over decision, which involved a dispute over money .","(CNN)Film director David Lynch has confirmed he will no longer direct the revival of ""Twin Peaks"" -- a cult 1990s television show that was set to return in 2016. The offbeat TV series, created by Lynch and Mark Frost, featured a quirky FBI agent who went to the Pacific Northwest town of Twin Peaks to investigate the mysterious murder of a high school girl named Laura Palmer. The groundbreaking series is considered one of the most influential shows in television history.",0.2854653298854828
8be49747e364357d7c5d32fca516ec230e5083ed,"Kentucky player mutters N-word under his breath about a Wisconsin player at postgame news conference .
Andrew Harrison, who is black, tweets that he apologized to Frank Kaminsky, who is white .
Kaminsky says he's talked it over with Harrison --  'I'm over it""","(CNN)A University of Kentucky basketball player is apologizing for the ""poor choice of words"" he muttered under his breath after the team's stunning loss to Wisconsin on Saturday. As a deflated panel of Wildcats fielded a reporter's question about Wisconsin standout Frank Kaminsky, a hot mic picked up Kentucky guard Andrew Harrison saying of Kaminsky, ""F**k that (N-word)."" Harrison, who is is black, said his words were ""in jest,"" and that he meant no disrespect to Kaminsky, who is white. ""First I want to apologize for my poor choice of words used in jest towards a player I respect and know,"" Harrison tweeted.",0.28459030389785767
23b01320d93bb8a0fce96fb0dc37bcebf3f179cb,"A man killed in a raid in the Philippines in January was a ""most wanted"" terrorist, the FBI says .
Marwan was a Malaysian believed to have provided support to Islamist terror groups .
44 elite Philippine commandos were killed in the raid on his hideout last month .","(CNN)The FBI has confirmed that one of its most wanted terrorists, the Malaysian bomb maker known as Marwan, was killed in an otherwise disastrous raid in the Philippines in January. Marwan, whose real name is Zulkifli bin Hir, was believed by the FBI to a member of southeast Asian terror group Jemaah Islamiyah's central command. The FBI said in February that a DNA sample -- understood to be from a severed finger -- taken from a man killed in a raid in the southern Philippines showed a link with a known relative of Marwan.",0.3271331191062927
7fb513044e371fa3354fc08eaac50975cf65666a,"Delaware family becomes ill at the Sirenusa resort in the U.S. Virgin Islands .
Preliminary EPA results find methyl bromide was present in unit where family stayed .
U.S. Justice Department has initiated a criminal investigation into the matter .","(CNN)The presence of a harmful pesticide at a luxury villa in the U.S. Virgin Islands may have resulted in the illness of a Delaware family, the U.S. Environmental Protection Agency said Friday.",0.272459477186203
c67a5be9af71197193435ab7073e964298851089,"Chris Rock posts selfies after being pulled over three times in last seven weeks .
""Stopped by the cops again wish me luck,"" he posted this week .","(CNN)Comedian Chris Rock made light of racial disparities in police treatment of whites and blacks with a tongue-in-cheek guide to not being beaten by the police. He encapsulated the frustration and grief caused by a New York grand jury's decision not to indict a white police officer in the death of a black man with a simple tweet: ""This one was on film."" Now, he's stirring things up again with a series of tweets documenting three traffic stops in seven weeks. ""Stopped by the cops again wish me luck,"" he posted early Tuesday, along with a photo showing him behind the wheel of a car with what looks like blue police lights in the background.",0.3012543320655823
599bf6f13bc8477d50aa7599baf53123a6e57708,"A blast rocks a chemical plant in China's southeastern Fujian province for the second time in two years .
Six were injured after the explosion and are being hospitalized .
The explosion was triggered by an oil leak, though local media has not reported any toxic chemical spills .","Hong Kong (CNN)Six people were hurt after an explosion at a controversial chemical plant in China's southeastern Fujian province sparked a huge fire, provincial authorities told state media. The plant, located in Zhangzhou city, produces paraxylene (PX), a reportedly carcinogenic chemical used in the production of polyester films and fabrics. The blast occurred at an oil storage facility Monday night after an oil leak, though local media has not reported any toxic chemical spill.",0.3134459853172302
e65440d2469c8d9fc44b6121ca6e7fd25e272eab,"Justice Department prosecuting FedEx over unauthorized shipment of drugs .
Danny Cevallos: FedEx has a strong argument that it shouldn't be held responsible .","(CNN)The United States Department of Justice has named a new defendant in the war on drugs, and the charges are serious indeed. A 15-count indictment filed in federal court in California bristles with accusations of conspiracies, transporting prescription pharmaceuticals dispensed with illegal prescriptions, violations of the Controlled Substances Act, misbranding charges, and money laundering charges. Who is this menace to society?",0.23414315283298492
e30518a464ea7096b1aa5a17b45570631e3cf080,"Mark Wahlberg is planning to appear in ""Patriots' Day""
The film will be about events surrounding the 2013 Boston Marathon bombing .
Another film, ""Boston Strong,"" is also in the works .","(CNN)Boston native Mark Wahlberg will star in a film about the Boston Marathon bombing and the manhunt that followed, Deadline reported Wednesday. Wahlberg's film, to be titled ""Patriots' Day,"" is being produced by CBS Films, which linked to the Deadline article from its website. According to Deadline, Wahlberg is hoping to play Boston Police Commissioner Ed Davis, who retired after the attack in 2013.",0.346973717212677
386b182672cd041d574a3fe0e9ccf2f16b751f2e,"""The Price Is Right"" gives away a car ... accidentally .
A model makes a big mistake during a game .
Host Drew Carey thought the error was hilarious .","(CNN)What do we have for the contestant on ""The Price Is Right""? A brand-new car! Whoops.",0.23303303122520447
192bf513d8adb0c0dd49d0dae337632838a1090e,"Carlos Colina, 32, is arraigned on charges of assault and battery, improper disposal of a body .
Body parts were discovered Saturday in a duffel bag and a common area of an apartment building .
The victim in the case is identified as Jonathan Camilien, 26; authorities say he knew Colina .","(CNN)Authorities identified and charged a man Monday in connection with the discovery of human remains in a duffel bag in Cambridge, Massachusetts, over the weekend. Carlos Colina, 32, was arraigned on charges of assault and battery causing serious bodily injury and improper disposal of a body, the Middlesex District Attorney's Office said in a statement. ""This was a gruesome discovery,"" said District Attorney Marian Ryan.",0.32330769300460815
8ec9aabea31ae79f0d429e9ab2e4a1a4f8d1b605,"Fan favorite series ""Arrested Development"" to return for a fifth season, according to producer .
Brian Grazer claimed the show would be back in a podcast .
Netflix is not commenting .","(CNN)For those wondering if we would ever hear from the Bluth family again, the answer would appear to be yes. ""Arrested Development"" executive producer Brian Grazer said the show will return for a fifth season of 17 episodes. The Hollywood mogul was interviewed on Bill Simmons' podcast recently, and let it drop that fans can expect more of the quirky comedy.",0.258145809173584
25a52d1de3a385d6d1405272f7dff0813fcd3b2d,"""Mad Men's"" final seven episodes begin airing April 5 .
The show has never had high ratings but is considered one of the great TV series .
It's unknown what will happen to characters, but we can always guess .","(CNN)This is the end. Beautiful friend, the end. For the 1960s, the end arrived with -- depending on your ideals and your tribe -- either the Rolling Stones' Altamont fiasco in December 1969, the Kent State shootings in May 1970 or Richard Nixon's 1972 re-election.",0.1178373247385025
9fbd984bd3a49c69074601a62d5d1d05bbeb2237,"""Vampire Diaries"" star Nina Dobrev announces she's leaving the show .
""Nothing will be the same again,"" fans say .","(CNN)Just kill it already. That was the sentiment of many ""Vampire Diaries"" fans on Tuesday after star Nina Dobrev announced she will be leaving the CW show at the end of this season. ""I always knew I wanted Elena's story to be a six season adventure, and within those six years I got the journey of a lifetime,"" she posted on her social media accounts after a ""goodbye party"" at Lake Lanier outside Atlanta, where the show is filmed.",0.2622002363204956
947eeb8bbfec54f46a6ee0dd066b7bd6007dc630,"Federal education minister Smriti Irani visited a FabIndia store in Goa, saw cameras .
Authorities discovered the cameras could capture photos from the store's changing room .
The four store workers arrested could spend 3 years each in prison if convicted .","New Delhi, India (CNN)Police have arrested four employees of a popular Indian ethnic-wear chain after a minister spotted a security camera overlooking the changing room of one of its stores. Federal education minister Smriti Irani was visiting a FabIndia outlet in the tourist resort state of Goa on Friday when she discovered a surveillance camera pointed at the changing room, police said. Four employees of the store have been arrested, but its manager -- herself a woman -- was still at large Saturday, said Goa police superintendent Kartik Kashyap.",0.4514404535293579
e4fcad9e8cf8acbf076000d7232e9513dafb6743,"The group included four children, Turkish official says .
Turkish military didn't say what group's intent was .
UK Foreign Office says it is trying to get information from Turkish officials .","(CNN)Nine British citizens were arrested in Turkey on Wednesday, suspected of trying to cross illegally into Syria, the Turkish military said on its website. The group included four children -- the oldest being 10 or 11, with the youngest born in 2013, a Turkish official told CNN on condition of anonymity. The nine were arrested at the Turkey-Syria border, the Turkish military said.",0.3009047508239746
61a6105642804ffdb55a3b78f74380f8d099cde6,"Submarine is in Zvyozdochka shipyard, in northwestern Russia .
No ""dangerous"" substances on the submarine, shipyard spokesman told ITAR-Tass .","(CNN)A nuclear submarine being repaired at a Russian shipyard has caught on fire, according to a law enforcement source speaking to Russia's state-run news agency ITAR-Tass. ""The submarine is in a dry dock,"" Tass reports, citing the source, and there is no ammunition on board. ""The rubber insulation between the submarine's light and pressure hull is on fire,"" Tass reported.",0.2889716923236847
996940764a066a9c16f622c873ad041ac5521fa3,"Kayahan wrote some of Turkey's best-loved pop songs .
The singer was first diagnosed with cancer in 1990 .
He most recently performed in February in Istanbul .","(CNN)Kayahan, one of Turkey's best-loved singers and songwriters, died of cancer Friday at the age of 66. He had performed most recently in Istanbul on Valentine's Day. The performer, who was also an accomplished guitarist, was first diagnosed with cancer in 1990, the year he competed in the Eurovision Song Contest, and the year before he released the album that ignited his career.",0.41137540340423584
d96576c5c5e667d33e2f2117584bf796bd66389a,"Prosecutors formally charged former top official Zhou Yongkang .
Zhou charged with accepting bribes, abuse of power and leaking state secrets .
Former domestic security official is the most senior Chinese official to face corruption charges .","Beijing (CNN)China's state prosecutors on Friday formally charged the country's former security czar with accepting bribes, making him the highest-ranking Chinese Communist Party official ever to face corruption charges. Zhou Yongkang, 72, was also charged with abuse of power and leaking state secrets, the Supreme People's Procuratorate, the highest prosecution authority in China, said. As a member of the ruling Communist Party's Politburo Standing Committee -- China's top decision-making body -- Zhou was one of nine men who effectively ruled the country of more than 1.3 billion people.",0.3502388596534729
